<?xml version="1.0" encoding="UTF-8"?>
<CONF xmlns="www.rbin.com/mds-1" xmlns:xsi="http://www.w3.org/2001/XMLSchema-instance" xsi:schemaLocation="www.rbin.com/mds-1 file:///C:/Program%20Files/Bosch/Hexmod/schemas/rules.xsd">
	<HEXMOD>
		<ERRMOD>
			<LOG FILE="hexmodX_XML.log"/>
			<MSGLOG LVL="1"/>
			<MSGCONSOLE LVL="1"/>
			<PROGABORT LVL="3"/>
		</ERRMOD>
		<MAINMOD>
			<LOADDLL>
				<DLL NAME="BaseIO" CFG="Input.xml"/>
				<DLL NAME="InfoBlock" CFG="InfoBlock.xml"/>
				<DLL NAME="BaseIO" CFG="Output.xml"/>
			</LOADDLL>
		</MAINMOD>
	</HEXMOD>
</CONF>
